<?xml version="1.0" encoding="UTF-8"?>
<!DOCTYPE contacts PUBLIC "-//at.motriv//contacts//EN" "http://www.motriv.at/dtd/contacts.dtd">
<contacts version="1.0">
  <contact id="2987855c-2d02-4ff6-8697-1779ba5edd7a">
    <name>unbekannt</name>
    <type name="MANUFACTURER"/>
    <type name="RETAILER"/>
  </contact>
  <contact id="ca6c1920-1aed-46a4-91dd-59b98bc34821">
    <name>Eigenbau</name>
    <type name="MANUFACTURER"/>
  </contact>
  <contact id="aa0081c2-413d-447a-abc3-3e58897174b2">
    <name>keiner</name>
    <type name="RETAILER"/>
  </contact>
</contacts>
